rsid,genotype,trait,interpretation,snpedia_url
rs4988235,AG,Lactosa,Puedes digerir la lactosa en edad adulta (lactasa persistente).,https://www.snpedia.com/index.php/rs4988235
rs762551,AA,Cafeína,Metabolizadora rápida: puedes tomar más café sin efectos fuertes.,https://www.snpedia.com/index.php/rs762551
rs1800497,GG,Dopamina / riesgo de adicción,"Genotipo neutro, sin aumento del riesgo de adicción.",https://www.snpedia.com/index.php/rs1800497
rs1799971,AA,Tolerancia al dolor,Genotipo común. No afecta significativamente la tolerancia al dolor.,https://www.snpedia.com/index.php/rs1799971
rs738409,CG,Riesgo hepático (hígado graso),Una copia de riesgo. Cuida tu dieta y evita exceso de alcohol.,https://www.snpedia.com/index.php/rs738409
rs9939609,AT,Obesidad (FTO),"Riesgo intermedio, mayor apetito o menor saciedad.",https://www.snpedia.com/index.php/rs9939609
rs1801133,AG,Ácido fólico / MTHFR,Una copia alterada. Puede ser útil complementar con ácido fólico.,https://www.snpedia.com/index.php/rs1801133
rs1695,AA,Detoxificación (GSTP1),Buena capacidad de detoxificación natural.,https://www.snpedia.com/index.php/rs1695
